{
  "$schema": "http://json-schema.org/draft-07/schema#",
  "$id": "content-org://contracts/schemas/main-agent-response.schema.json",
  "title": "Content org main agent response (structured mode)",
  "description": "When json_output is on (default), CCO, content-lead, and other top-level org agents emit this object as their entire final message. Validate after JSON.parse.",
  "type": "object",
  "additionalProperties": true,
  "required": [
    "schema_version",
    "contract",
    "agent",
    "json_output",
    "status",
    "summary",
    "next_actions"
  ],
  "properties": {
    "schema_version": { "type": "integer", "const": 1 },
    "contract": { "type": "string", "const": "main-agent-response-v1" },
    "agent": { "type": "string", "minLength": 1 },
    "json_output": {
      "type": "boolean",
      "const": true,
      "description": "Must be true in this schema; prose mode omits this payload."
    },
    "status": {
      "type": "string",
      "enum": ["ok", "warn", "blocked", "error"]
    },
    "summary": {
      "type": "string",
      "description": "Executive summary for operators and n8n (caveman-lite unless user asked for fuller prose)."
    },
    "next_actions": {
      "type": "array",
      "items": { "type": "string" }
    },
    "plan_path": {
      "type": "string",
      "description": "Path to plan file written on disk, if applicable."
    },
    "approved_plan_path": { "type": "string" },
    "execution_mode": {
      "type": "string",
      "enum": ["phase_by_phase", "all_phases", "automation", "interactive"]
    },
    "artifacts": {
      "type": "array",
      "items": { "type": "string" }
    },
    "user_facing_plain": {
      "type": "string",
      "description": "Optional readable narrative inside JSON for humans/automation that also logs structured fields."
    },
    "findings": { "type": "array" },
    "errors": {
      "type": "array",
      "items": { "type": "string" }
    },
    "task_id": { "type": "string" },
    "workspace_root": { "type": "string" }
  }
}
